{
  "schema": "m64k.native.contract/v2",
  "isa_family": "M64K-native",
  "isa_version": "M64K-v1",
  "profile_kind": "native-64-system-profile",
  "status": "development",
  "semantic_contracts": [
    {
      "contract_id": "M64K-v1.scalar-integer-alu",
      "path": "semantics/scalar-integer-alu-v1.json",
      "validation_schema": "semantics/scalar-integer-alu-schema-v1.json",
      "schema": "m64k.native.instruction-semantics/v1",
      "status": "normative-draft",
      "encoding_status": "unallocated"
    },
    {
      "contract_id": "M64K-v1.scalar-shift-rotate",
      "path": "semantics/scalar-shift-rotate-v1.json",
      "validation_schema": "semantics/scalar-shift-rotate-schema-v1.json",
      "schema": "m64k.native.instruction-semantics/v1",
      "status": "normative-draft",
      "encoding_status": "unallocated"
    },
    {
      "contract_id": "M64K-v1.scalar-multiply-divide",
      "path": "semantics/scalar-multiply-divide-v1.json",
      "validation_schema": "semantics/scalar-multiply-divide-schema-v1.json",
      "schema": "m64k.native.instruction-semantics/v1",
      "status": "normative-draft",
      "encoding_status": "unallocated"
    }
  ],
  "backend_claims": {
    "semantic_inventory_closed": false,
    "encoding_frozen": false,
    "elf_abi_frozen": false,
    "assembler_ready": false,
    "disassembler_ready": false,
    "linker_ready": false,
    "compiler_backend_ready": false,
    "linux_uapi_ready": false,
    "rtl_decoder_ready": false,
    "backend_ready": false,
    "blockers": [
      "The MC68060 instruction corpus is enumerated, but every semantic disposition remains subject to instruction-level review and approval.",
      "The fixed32 base opcode, extended escape, and operand fields are unallocated.",
      "The official ELF machine identifier and RELA relocation numbers are unassigned.",
      "No software backend or RTL decoder may claim readiness before the semantic, encoding, and ABI freezes."
    ]
  },
  "registers": {
    "general": {"names": "r0-r31", "count": 32, "width_bits": 64, "all_writable": true, "zero_register": null},
    "floating_point": {"names": "f0-f31", "count": 32, "width_bits": 64, "formats": ["binary32", "binary64"]},
    "predicates": {"names": "p0-p7", "count": 8, "width_bits": 1, "p0": "hardwired-true-writes-ignored", "writable": "p1-p7", "state_scope": "per-hardware-thread"},
    "program_counter": {"name": "PC", "width_bits": 64},
    "condition_state": {
      "nzcv": {"name": "NZCV", "bits_msb_to_lsb": ["N", "Z", "C", "V"], "packed_encoding": {"N": 3, "Z": 2, "C": 1, "V": 0}, "width_bits": 4},
      "extend": {"name": "X", "width_bits": 1, "separate_from_carry": true, "state_scope": "per-hardware-thread", "modified_only_by": ["ADCX", "SBCX", "NEGX", "rotate-through-X"]}
    }
  },
  "scalar_widths": {
    "address_bits": 64,
    "integer_operand_bits": [8, 16, 32, 64],
    "floating_operand_bits": [32, 64],
    "suffixes": {"B": 8, "W": 16, "L": 32, "Q": 64, "S": 32, "D": 64},
    "general_register_write": {"B": "zero-extend-8-to-64", "W": "zero-extend-16-to-64", "L": "zero-extend-32-to-64", "Q": "replace-all-64", "explicit_sign_extend": "sign-extend-source-to-64"}
  },
  "assembly": {
    "architectural_statement": "exactly-one-instruction",
    "multi_instruction_pseudoinstructions": "forbidden",
    "aliases": "one-to-one-encoding-only",
    "familiar_m68k_names": "permitted-only-when-m64k-semantics-are-explicitly-equivalent",
    "source_compatibility_claim": false
  },
  "floating_point": {
    "required": true,
    "standard": "IEEE-754-2019",
    "formats": ["binary32", "binary64"],
    "fused_multiply_add": true,
    "extended_binary80": false,
    "packed_decimal": false
  },
  "product_topology": {
    "cores": 4,
    "hardware_threads_per_core": 2,
    "architectural_contexts": 8,
    "identity_contract": "core-hardware-thread-transaction-privilege-domain-address-space-explicit"
  },
  "implementation_target": {
    "status": "design-target-not-implementation-claim",
    "implemented": false,
    "core": {
      "execution_model": "out-of-order",
      "decode_instructions_per_cycle": 4,
      "retire_instructions_per_cycle": 4,
      "issue_uops_per_cycle": 6,
      "rob_entries_per_core": 192,
      "rob_identity_requirement": "context-index-generation-allocation-sequence-uop",
      "precise_retirement": true
    },
    "scalability": {
      "cores": 4,
      "hardware_threads_per_core": 2,
      "single_core_single_thread_is_validation_projection_only": true,
      "shared_structure_identity_requirement": "every-entry-and-response-retains-owning-core-and-hardware-thread"
    },
    "deferred_extensions": {
      "scalable_vector": "separate-versioned-extension-required",
      "matrix_tile": "separate-versioned-extension-required",
      "fixed-vector-length_or_tile_geometry_in_base_interfaces": "forbidden"
    }
  },
  "encoding": {
    "instruction_alignment_bytes": 4,
    "instruction_byte_order": "big-endian",
    "base_envelope": {"name": "fixed32", "instruction_bits": 32, "instruction_bytes": 4, "allocation_status": "unfrozen", "opcode_patterns": [], "operand_field_layouts": []},
    "extended_envelope": {"name": "extended", "status": "reserved-unassigned", "escape_selector": null, "minimum_instruction_bytes": 8, "maximum_instruction_bytes": 16, "length_granule_bytes": 4, "opcode_patterns": [], "reserved_spaces": ["M64K-A", "M64K-FD", "M64K-V", "M64K-M", "FUTURE", "VENDOR"]},
    "illegal_default": "Every unallocated or malformed base word and every unallocated extended escape traps as IllegalInstruction without architectural effects."
  },
  "semantic_baseline": {
    "compatibility_claim": false,
    "cut_line": "MC68060",
    "closed_world": true,
    "semantic_inventory": {
      "path": "mc68060-semantic-cut-line.json",
      "schema": "m64k.mc68060-semantic-cut-line/v2",
      "required_status_for_closure": "approved"
    },
    "coverage_policy": {
      "computational_baseline_member": "architectural-m64k-analogue-required",
      "architectural_statement": "exactly-one-instruction",
      "computational_lineage_dispositions": ["native-analogue"],
      "legacy_system_lineage_dispositions": ["modern-system-replacement", "rejected"],
      "architectural_identities": ["distinct-instruction", "one-to-one-alias", "system-facility", "absent", "unresolved"],
      "lowering_strategies": ["direct-uops", "microcode", "no-execution", "unresolved"],
      "microcode_visibility": "architecturally-invisible",
      "alias_expansion": "exactly-one-identical-encoding"
    },
    "corpus_closure": {
      "status": "incomplete",
      "required_granularity": "one row per instruction or system contract unless every named member has identical behavior in every disposition dimension",
      "blockers": [
        "Replace the three aggregate ledger rows with reviewed multidimensional dispositions for every entry in the linked MC68060 semantic inventory.",
        "Add the applicable MC68020, MC68030, and MC68040 delegated manual identities and errata before approving affected rows."
      ]
    },
    "source_documents": [
      {"document_id": "MC68060UM", "title": "M68060 User's Manual", "revision": "1", "sha256": "313fd672dfac8f1d1bb580ad61e8e1583a38b07fb4e2891aff7f29ef49d3ef40"},
      {"document_id": "MC68060UMAD/AD", "title": "Addendum to MC68060 User Manual", "revision": "0", "sha256": "7d43c762f49a3ad3b0856e7425432c44ebd199de0ae619d1b3342429ba91b91a"},
      {"document_id": "MC68060DE", "title": "MC68060 Production Device Errata", "revision": "4.0", "sha256": "8d396ab5ef7757dfeec84b61ed7ad96e92a1339da59949be6bb90257961f046f"}
    ],
    "inventory": [
      {"baseline_id": "MC68060.scalar-integer-instruction-set", "kind": "instruction-corpus", "member_enumeration_complete": false},
      {"baseline_id": "MC68060.floating-point-instruction-set", "kind": "instruction-corpus", "member_enumeration_complete": false},
      {"baseline_id": "MC68060.system-architecture", "kind": "system-corpus", "member_enumeration_complete": false}
    ],
    "ledger": [
      {
        "baseline_id": "MC68060.scalar-integer-instruction-set",
        "m64k_contract_ids": ["M64K-v1.scalar-integer-corpus-pending"],
        "lineage_disposition": "native-analogue",
        "architectural_identity": "unresolved",
        "lowering_strategy": "unresolved",
        "review_status": "inventory-required",
        "sources": [{"document_id": "MC68060UM", "section": "1.9 Instruction Set Overview, Table 1-3", "pages": "1-16 through 1-20"}],
        "disposition": {
          "encoding": {"relation": "rejected", "detail": "M64K does not decode Motorola opcodes; numeric M64K encoding remains unallocated."},
          "widths": {"relation": "modified", "detail": "M64K adds native 64-bit scalar operands and defines deterministic extension for narrower GPR writes."},
          "registers": {"relation": "rejected", "detail": "M64K uses thirty-two unified writable 64-bit GPRs instead of data and address register banks."},
          "operands": {"relation": "modified", "detail": "M64K uses explicit native load/store and register operand forms rather than Motorola effective-address encoding."},
          "result": {"relation": "modified", "detail": "Individual result rules require instruction-granular audit before allocation."},
          "flags_predicates": {"relation": "modified", "detail": "M64K uses explicit flag-producing forms, predicates, and a separately renameable persistent X state."},
          "exceptions": {"relation": "modified", "detail": "M64K uses native precise trap CSRs and priorities; instruction-specific causes remain to be enumerated."},
          "restart": {"relation": "modified", "detail": "M64K restarts at a precise retirement boundary without Motorola stack frames."},
          "memory": {"relation": "modified", "detail": "M64K uses 64-bit virtual addresses, explicit load/store operations, big-endian data, and normative TSO."},